{
  "schema": "t4-contract/evidence",
  "version": 1,
  "delivery_id": "d-20261011-ff71bd",
  "scope": {
    "kind": "step",
    "step": "S4"
  },
  "phase": "step",
  "expected": "pass",
  "inputs": {
    "spec_sha256": "da4b5a1d37842f280a0bd6c0f497966e0b318aad500e19b3f9f2ad3a0d68fe5b",
    "plan_sha256": "53f1939aa9a9a4389f34f77f7c03d652b84592f3675bf843a0078f505516efde"
  },
  "code": {
    "snapshot_sha256": "d208bb5bd22bf5e8680d043e2401a6ac9c9fbfba31aae7481dd73bf2eafe3c11",
    "head": "68ba598ba96694753687c1b5ca67ee3a76c61814",
    "files": 130
  },
  "commands": [
    {
      "argv": [
        "sh",
        "tests/render/test_m2_demo.sh",
        "build/cwiki-m2-demo"
      ],
      "exit_code": 0,
      "signal": null,
      "status": "passed"
    },
    {
      "argv": [
        "make",
        "demo"
      ],
      "exit_code": 0,
      "signal": null,
      "status": "passed"
    }
  ],
  "status": "passed",
  "started_at": "2026-10-12T01:24:24.726Z",
  "finished_at": "2026-10-12T01:24:27.503Z",
  "output_ref": "ai-factory/runs/evidence/d-20261011-ff71bd/S4-step.log",
  "output_sha256": "84fe5da73a269948bed148bcc731b065ad6d1a1394c104d947768e089cf24851"
}
