{
  "schema": "t4-contract/evidence",
  "version": 1,
  "delivery_id": "d-20261011-ff71bd",
  "scope": {
    "kind": "step",
    "step": "S2"
  },
  "phase": "step",
  "expected": "pass",
  "inputs": {
    "spec_sha256": "da4b5a1d37842f280a0bd6c0f497966e0b318aad500e19b3f9f2ad3a0d68fe5b",
    "plan_sha256": "26dbcd91e8ccaa50eb9a30bad48671c6fb7e986f3ae64798c3b9b44fecd2aada"
  },
  "code": {
    "snapshot_sha256": "46627273f70b405ee071b6cba6999c9ee3f2bff5f10b0be77f0b82917e1afd18",
    "head": "0c9aeea1e79b027108c8b4e78cae56b3a6f9664e",
    "files": 123
  },
  "commands": [
    {
      "argv": [
        "sh",
        "tests/render/check_render_fixture.sh"
      ],
      "exit_code": 0,
      "signal": null,
      "status": "passed"
    }
  ],
  "status": "passed",
  "started_at": "2026-10-11T23:53:54.751Z",
  "finished_at": "2026-10-11T23:53:54.989Z",
  "output_ref": "ai-factory/runs/evidence/d-20261011-ff71bd/S2-step.log",
  "output_sha256": "a48275cca9060fd1d5c21f86c10b6e1fe2956f61dce9b7d6098101c8d74aeeae"
}
