{
  "schema": "t4-contract/evidence",
  "version": 1,
  "delivery_id": "d-20261011-ff71bd",
  "scope": {
    "kind": "step",
    "step": "S6"
  },
  "phase": "step",
  "expected": "pass",
  "inputs": {
    "spec_sha256": "da4b5a1d37842f280a0bd6c0f497966e0b318aad500e19b3f9f2ad3a0d68fe5b",
    "plan_sha256": "26dbcd91e8ccaa50eb9a30bad48671c6fb7e986f3ae64798c3b9b44fecd2aada"
  },
  "code": {
    "snapshot_sha256": "d208bb5bd22bf5e8680d043e2401a6ac9c9fbfba31aae7481dd73bf2eafe3c11",
    "head": "252f051ed3dd4d4475435d2c54880a8cfae3ffb2",
    "files": 130
  },
  "commands": [
    {
      "argv": [
        "sh",
        "tests/docs/check_m2_closure.sh"
      ],
      "exit_code": 0,
      "signal": null,
      "status": "passed"
    }
  ],
  "status": "passed",
  "started_at": "2026-10-12T01:09:07.323Z",
  "finished_at": "2026-10-12T01:09:07.566Z",
  "output_ref": "ai-factory/runs/evidence/d-20261011-ff71bd/S6-step.log",
  "output_sha256": "1ddcca01f2e1d24fb13bd0022eae7204b587ffcad224f2ee084d17defe10723c"
}
