{
  "schema": "t4-contract/evidence",
  "version": 1,
  "delivery_id": "d-20261011-ff71bd",
  "scope": {
    "kind": "final"
  },
  "phase": "final",
  "expected": "pass",
  "inputs": {
    "spec_sha256": "da4b5a1d37842f280a0bd6c0f497966e0b318aad500e19b3f9f2ad3a0d68fe5b",
    "plan_sha256": "53f1939aa9a9a4389f34f77f7c03d652b84592f3675bf843a0078f505516efde"
  },
  "code": {
    "snapshot_sha256": "65bb6007a92886272a5efda6d5bbf1e54f1688b76edf4dda40c4b46499a716ac",
    "head": "92dadb0cd44ac2bbcb1d8a06f62a3b099e81c159",
    "files": 131
  },
  "commands": [
    {
      "argv": [
        "git",
        "diff",
        "--exit-code",
        "152787c",
        "--",
        "src",
        "tests/snapshots",
        "tests/fixtures/keys"
      ],
      "exit_code": 0,
      "signal": null,
      "status": "passed"
    },
    {
      "argv": [
        "make",
        "verify"
      ],
      "exit_code": 0,
      "signal": null,
      "status": "passed"
    },
    {
      "argv": [
        "env",
        "CWIKI_REQUIRE_TEX=1",
        "make",
        "check"
      ],
      "exit_code": 0,
      "signal": null,
      "status": "passed"
    },
    {
      "argv": [
        "make",
        "demo"
      ],
      "exit_code": 0,
      "signal": null,
      "status": "passed"
    }
  ],
  "status": "passed",
  "started_at": "2026-10-12T11:46:39.838Z",
  "finished_at": "2026-10-12T11:49:34.769Z",
  "output_ref": "ai-factory/runs/evidence/d-20261011-ff71bd/final.log",
  "output_sha256": "526e69335f339083963723d8d20d7d7435c54770f64fb9007cf334b1d450129e"
}
