{
  "schema": "t4-contract/evidence",
  "version": 1,
  "delivery_id": "d-20261012-251ff8",
  "scope": {
    "kind": "step",
    "step": "S6"
  },
  "phase": "step",
  "expected": "pass",
  "inputs": {
    "spec_sha256": "56d4a50c597fd22676a73d3b3508ef9de200a07bf62d7cbd4d7c0ec74aba99ff",
    "plan_sha256": "f56a2f59c6c46d151a62c7b0f3315a26cd1b4f1a70ee314b26cb738623e065e5"
  },
  "code": {
    "snapshot_sha256": "8795f0cc721eef7298c224abbf546a1556ae757cf8568ed1dc2433e237b3c593",
    "head": "2df882101148fa328cc42dc68c024f6e62be1010",
    "files": 144
  },
  "commands": [
    {
      "argv": [
        "make",
        "build/test-tex-source"
      ],
      "exit_code": 0,
      "signal": null,
      "status": "passed"
    },
    {
      "argv": [
        "build/test-tex-source"
      ],
      "exit_code": 0,
      "signal": null,
      "status": "passed"
    }
  ],
  "status": "passed",
  "started_at": "2026-10-12T22:39:58.561Z",
  "finished_at": "2026-10-12T22:39:58.719Z",
  "output_ref": "ai-factory/runs/evidence/d-20261012-251ff8/S6-step.log",
  "output_sha256": "532c357d084ce1cc5b9b2eb7848330ce0da64a01d4e4779b88cbc6b6c6d16d17"
}
