{
  "schema": "t4-contract/evidence",
  "version": 1,
  "delivery_id": "d-20261012-251ff8",
  "scope": {
    "kind": "step",
    "step": "S3"
  },
  "phase": "step",
  "expected": "pass",
  "inputs": {
    "spec_sha256": "56d4a50c597fd22676a73d3b3508ef9de200a07bf62d7cbd4d7c0ec74aba99ff",
    "plan_sha256": "5c102ddba8a6fe7fd8073ebe953bcf04f8d0b9b91b4a3a8294f86f0a265e3eb5"
  },
  "code": {
    "snapshot_sha256": "64a6a28e950fdda69a0976ad68ec6aefdcfb2cc41ec1123d868f14c1f29fbcba",
    "head": "1508c3724f843d3db6503b11b3209736a7749204",
    "files": 134
  },
  "commands": [
    {
      "argv": [
        "make",
        "build/test-config"
      ],
      "exit_code": 0,
      "signal": null,
      "status": "passed"
    },
    {
      "argv": [
        "build/test-config"
      ],
      "exit_code": 0,
      "signal": null,
      "status": "passed"
    }
  ],
  "status": "passed",
  "started_at": "2026-10-12T17:18:39.912Z",
  "finished_at": "2026-10-12T17:18:40.118Z",
  "output_ref": "ai-factory/runs/evidence/d-20261012-251ff8/S3-step.log",
  "output_sha256": "9c0816ab80baa602cf9d70d6e64353499efd954ce15c35cd0fc356833da17978"
}
