{
  "schema": "t4-contract/evidence",
  "version": 1,
  "delivery_id": "d-20261011-ff71bd",
  "scope": {
    "kind": "review"
  },
  "phase": "final",
  "expected": "pass",
  "inputs": {
    "spec_sha256": "da4b5a1d37842f280a0bd6c0f497966e0b318aad500e19b3f9f2ad3a0d68fe5b",
    "plan_sha256": "53f1939aa9a9a4389f34f77f7c03d652b84592f3675bf843a0078f505516efde"
  },
  "code": {
    "snapshot_sha256": "65bb6007a92886272a5efda6d5bbf1e54f1688b76edf4dda40c4b46499a716ac",
    "head": "41f79221e47c937fdfb893e8c4ad4424bee12051",
    "files": 131
  },
  "commands": [
    {
      "argv": [
        "make",
        "review"
      ],
      "exit_code": 0,
      "signal": null,
      "status": "passed"
    }
  ],
  "status": "passed",
  "review": {
    "tool": "claude",
    "verdict": "approve",
    "output_sha256": "938a1a54c9037a8c0689717daa30aab7a2d307524e7cc47b37620c9985ec7472",
    "findings": [
      {
        "severity": "minor",
        "file": "tests/docs/check_s1_gaps.sh",
        "line": 24,
        "issue": "The AC3 guard regex (`R1\\.12\\.7|R6\\.4\\.1|R1\\.12\\.9a|R1\\.8\\.7`) still omits R6.3.3a. The S10 row now correctly cites 'R6.3.3 (search part)', but a regression that puts the deferred link-navigation id back into an open scope row would pass the check."
      },
      {
        "severity": "minor",
        "file": "tests/docs/check_s1_gaps.sh",
        "line": 1,
        "issue": "No make target, script or step evidence runs check_s1_gaps.sh. Only review.json mentions it, so its AC2, AC10, AC16-AC19 and AC21 assertions are manual. Its AC21 `git diff 152787c -- src` will fail for good once S2 touches src/, so it cannot join `make check` as written."
      },
      {
        "severity": "minor",
        "file": "tests/support/fixture_vault.c",
        "line": 42,
        "issue": "copy_file opens the destination with O_CREAT|O_TRUNC but without O_EXCL or O_NOFOLLOW, and copy_tree accepts EEXIST from mkdir and recurses into the existing directory. If a destination root already holds a symlink, the copy would follow it and write outside the root. That breaks the plan's rule tha"
      },
      {
        "severity": "minor",
        "file": "tests/support/m2_demo.c",
        "line": 52,
        "issue": "The root is copied into saved[4096] with an unchecked snprintf. If the path were truncated, the access() check after destroy would test the wrong path and could pass falsely."
      },
      {
        "severity": "minor",
        "file": "docs/ACCEPTANCE.md",
        "line": 189,
        "issue": "The S5 scope row cites R6.1.3 and R9.3.1, but the ROADMAP S5 Slices row also lists 'R6.1.4 inputs' (cell metrics and colours that feed the render key). Each slice's R ids should match the ROADMAP Slices table."
      },
      {
        "severity": "minor",
        "file": ".github/workflows/ci.yml",
        "line": 68,
        "issue": "The macOS BasicTeX cache restores /usr/local/texlive only. On a cache hit, the cask's /etc/paths.d entry and the /Library/TeX symlinks are absent, and restoring into root-owned /usr/local has not been tried on a runner. The PATH loop should still find the binaries, but this is unproven, as ADR 0003 "
      }
    ],
    "independence": "independent",
    "boundary": "make review"
  },
  "started_at": "2026-10-12T11:51:10.479Z",
  "finished_at": "2026-10-12T11:51:10.479Z"
}
