{
  "schema": "t4-contract/evidence",
  "version": 1,
  "delivery_id": "d-20261012-251ff8",
  "scope": {
    "kind": "final"
  },
  "phase": "final",
  "expected": "pass",
  "inputs": {
    "spec_sha256": "56d4a50c597fd22676a73d3b3508ef9de200a07bf62d7cbd4d7c0ec74aba99ff",
    "plan_sha256": "605c4c975d3a725d155d1cc5358303a53d369bb7c6968045636f43d333e1fca5"
  },
  "code": {
    "snapshot_sha256": "a85758461b8be5f675f103e32df5d39f7bceafafcb6c89947fa810c070be74fb",
    "head": "4412ecfe969c85eb7d762bb87fc6517894c0d0b4",
    "files": 149
  },
  "commands": [
    {
      "argv": [
        "git",
        "diff",
        "--exit-code",
        "135a625",
        "--",
        "tests/snapshots",
        "tests/fixtures/keys",
        "tests/fixtures/vaults/m2-render/class-note.md",
        "tests/fixtures/vaults/m2-render/.cwiki/preamble.tex"
      ],
      "exit_code": 0,
      "signal": null,
      "status": "passed"
    },
    {
      "argv": [
        "git",
        "diff",
        "--exit-code",
        "3b936ee",
        "--",
        "src/zone.c"
      ],
      "exit_code": 0,
      "signal": null,
      "status": "passed"
    },
    {
      "argv": [
        "make",
        "verify"
      ],
      "exit_code": 0,
      "signal": null,
      "status": "passed"
    },
    {
      "argv": [
        "env",
        "CWIKI_REQUIRE_TEX=1",
        "make",
        "check"
      ],
      "exit_code": 0,
      "signal": null,
      "status": "passed"
    },
    {
      "argv": [
        "sh",
        "tests/render/check_s2_boundaries.sh"
      ],
      "exit_code": 0,
      "signal": null,
      "status": "passed"
    }
  ],
  "status": "passed",
  "started_at": "2026-10-13T15:05:18.501Z",
  "finished_at": "2026-10-13T15:08:28.100Z",
  "output_ref": "ai-factory/runs/evidence/d-20261012-251ff8/final.log",
  "output_sha256": "d7551a5089fc4e563e1a2dfd26e8ab1f78bd03aff3d1a6ae777000794ac2a1b3"
}
