{
  "schema": "t4-contract/evidence",
  "version": 1,
  "delivery_id": "d-20261012-251ff8",
  "scope": {
    "kind": "step",
    "step": "S9"
  },
  "phase": "step",
  "expected": "pass",
  "inputs": {
    "spec_sha256": "56d4a50c597fd22676a73d3b3508ef9de200a07bf62d7cbd4d7c0ec74aba99ff",
    "plan_sha256": "092a3dba0e46df8cb9651dc85f9d302e17ddeb32f06cea6b3dfec3c9bbaf28e2"
  },
  "code": {
    "snapshot_sha256": "0ef13d3b7544bec2c2a249bc6cd5442a42b32221dfcbbb3629bb77c121d7e788",
    "head": "4af2e212d4fda4e292dcd358a56802205383a73e",
    "files": 149
  },
  "commands": [
    {
      "argv": [
        "sh",
        "tests/render/check_s2_boundaries.sh"
      ],
      "exit_code": 0,
      "signal": null,
      "status": "passed"
    }
  ],
  "status": "passed",
  "started_at": "2026-10-13T15:35:51.911Z",
  "finished_at": "2026-10-13T15:35:52.075Z",
  "output_ref": "ai-factory/runs/evidence/d-20261012-251ff8/S9-step.log",
  "output_sha256": "cdadab6fb9672e4d082de02c41b7dd4bd2eeb16e9c7201f2da639b26d0f18732"
}
